{
  "$schema": "https://json-schema.org/draft/2020-12/schema",
  "$id": "https://github.com/TanaTTV/lyt/blob/main/schemas/lyt.result.v1.schema.json",
  "title": "lyt result v1",
  "type": "object",
  "required": ["schema", "version", "command", "ok", "results"],
  "properties": {
    "schema": { "const": "lyt.result.v1" },
    "version": { "type": "string" },
    "command": { "enum": ["download", "formats", "dry-run", "error"] },
    "ok": { "type": "boolean" },
    "results": {
      "type": "array",
      "items": {
        "type": "object",
        "required": ["url", "status"],
        "properties": {
          "url": { "type": "string" },
          "status": { "enum": ["downloaded", "skipped", "failed", "available", "planned"] },
          "videoId": { "type": ["string", "null"] },
          "mode": { "enum": ["audio", "video"] },
          "files": { "type": "array", "items": { "type": "string" } },
          "outputDir": { "type": "string" },
          "reason": { "enum": ["history", "exists", "max-filesize", "no-output"] },
          "title": { "type": "string" },
          "extractor": { "type": "string" },
          "webpageUrl": { "type": "string" },
          "source": { "type": "object" },
          "match": { "type": "object" },
          "warning": { "type": "string" },
          "command": { "type": "string" },
          "executable": { "type": "string" },
          "args": { "type": "array", "items": { "type": "string" } },
          "error": { "$ref": "#/$defs/error" }
        },
        "additionalProperties": true
      }
    },
    "warnings": { "type": "array", "items": { "type": "string" } },
    "error": { "$ref": "#/$defs/error" }
  },
  "$defs": {
    "error": {
      "type": "object",
      "required": ["message", "code"],
      "properties": {
        "message": { "type": "string" },
        "code": { "type": "integer" }
      },
      "additionalProperties": false
    }
  },
  "additionalProperties": false
}
